{
  "$schema": "./schemas/skill-draft-record.schema.json",
  "draft_id": "SKILL-DRAFT-001",
  "source_session_id": "SESSION-20260502-001",
  "title": "Schema Validation Workflow",
  "problem": "JSON schema作成後、validationテストが不足しており、sample configとの整合性確認が手動依存",
  "proposed_steps": [
    {
      "step": "schemaファイルを作成",
      "order": 1,
      "rationale": "spec.mdの定義に基づく"
    },
    {
      "step": "sample configファイルを作成",
      "order": 2,
      "rationale": "$schemaでschemaファイルを参照"
    },
    {
      "step": "validationテストを追加",
      "order": 3,
      "optional": false,
      "rationale": "pytest + jsonschemaで自動検証"
    },
    {
      "step": "CIでschema validationを実行",
      "order": 4,
      "optional": true,
      "rationale": "PR時に自動チェック"
    }
  ],
  "review_state": "draft",
  "linked_acceptance_ids": [],
  "linked_evidence_ids": [],
  "linked_task_id": "TASK-self-improvement-schemas",
  "author": "docs-core",
  "created_at": "2026-05-02T12:00:00Z",
  "schema_version": "1.0.0"
}